{
	"$schema": "https://json-schema.org/draft/2020-12/schema",
	"$id": "https://linked.art/api/1.0/schema/image.json",
	"title": "Visual Content Schema",
	"description": "_crm:E36\\_Visual\\_Item_\nThe visual content of a work.\nSee: [API](https://linked.art/api/1.0/endpoint/visual_work/) | [Model](https://linked.art/model/object/aboutness/#physical-object-and-visual-work)",
	"type": "object",
	"properties": {
		"@context": {"$ref": "core.json#/definitions/ContextStringOrArray"},
		"id": {"$ref": "core.json#/definitions/idProp"},				
		"type": {"allOf": [{"title": "General", "$ref": "core.json#/definitions/typeProp"}, 
			{"title": "Specific", "type": "string", "const": "VisualItem"}]},
		"_label": {"$ref": "core.json#/definitions/labelProp"},
		"identified_by": {"$ref": "core.json#/definitions/identified_byProp"},
		"classified_as": {"$ref": "core.json#/definitions/classified_asProp"},
		"referred_to_by": {"$ref": "core.json#/definitions/referred_to_byProp"},
		"equivalent": {"allOf": [{"title": "General", "$ref": "core.json#/definitions/equivalentProp"}, 
			{"title": "Specific", "description": "List of equivalent `VisualItem` entities", "type": "array", "items": {"$ref": "core.json#/definitions/VisualItemRef"}}]},
		"member_of": {"$ref": "core.json#/definitions/member_ofSetProp"},
		"subject_of": {"$ref": "core.json#/definitions/subject_ofProp"},
		"attributed_by": {"$ref": "core.json#/definitions/attributed_byRelProp"},
		"dimension": {"$ref": "core.json#/definitions/dimensionProp"},
		"subject_to": {"$ref": "core.json#/definitions/subject_toProp"},
		"part_of": {
			"title": "crm:P106i_forms_part_of",
			"description": "Reference to another Visual Item of which this is part", 
			"type": "array",
			"items": {"$ref": "core.json#/definitions/VisualItemRef"}},

		"about": {"$ref": "core.json#/definitions/aboutProp"},
		"created_by": {"title": "crm:P94i_was_created_by", "$ref": "core.json#/definitions/Creation"},
		"represents": {"title": "crm:P138_represents", "description": "An entity which is represented in this image content", "type": "array", "items": {"$ref": "core.json#/definitions/AnyRef"}},
		"represents_instance_of_type": {"title": "la:represents_instance_of_type", "description": "A Type of an entity, which is represented in this image content", "type": "array", "items": {"$ref": "core.json#/definitions/Concept"}},
		"used_for": {"title": "crm:P16i_was_used_for", "description": "", "type": "array", "items": {"$ref": "core.json#/definitions/Activity"}}

	},
	"required": ["@context", "id", "type", "_label"],
	"additionalProperties": false
}
