{
  "@context": "https://linked.art/ns/v1/linked-art.json",
  "id": "https://linked.art/example/visual/spring/2",
  "type": "VisualItem",
  "_label": "Visual Content of Spring",
  "about": [
    {
      "id": "http://vocab.getty.edu/aat/300133097",
      "type": "Type",
      "_label": "Spring (season)"
    }
  ]
}