{
  "@context": "https://linked.art/ns/v1/linked-art.json",
  "id": "https://linked.art/example/visual/spring/4",
  "type": "VisualItem",
  "_label": "Visual Content of Spring",
  "classified_as": [
    {
      "id": "http://vocab.getty.edu/aat/300015637",
      "type": "Type",
      "_label": "Portrait"
    }
  ]
}