{
  "@context": "https://linked.art/ns/v1/linked-art.json",
  "id": "https://linked.art/example/visual/nightwatch/40",
  "type": "VisualItem",
  "_label": "Appearance of Night Watch",
  "classified_as": [
    {
      "id": "http://vocab.getty.edu/aat/300021147",
      "type": "Type",
      "_label": "Baroque",
      "classified_as": [
        {
          "id": "http://vocab.getty.edu/aat/300015646",
          "type": "Type",
          "_label": "Style"
        }
      ]
    }
  ]
}